{
  "status": "SUCCESS",
  "planning_summary": "Planned objective: Create a v1 repo plan for AoS standard app",
  "plan": {
    "steps": [
      {
        "step_id": "step_001",
        "title": "Plan skeleton",
        "description": "Generate a deterministic plan and delegations.",
        "owner_role": "Foreman",
        "depends_on": [],
        "status": "done",
        "acceptance_criteria": [
          "Plan is schema-valid.",
          "Steps are deterministic."
        ],
        "artifacts_expected": []
      }
    ]
  },
  "delegations": [],
  "risks": [],
  "notes": "",
  "metrics": {
    "max_steps": 25
  }
}
